{
  "schemaVersion": "awesomeClaws.identityTheftRecovery.v1",
  "case": {
    "id": "case-rivera-2026",
    "ownerAuthorityRef": "owner-rivera",
    "authorizedHelperRefs": [],
    "jurisdictions": ["US", "US-CA"],
    "privacyCeiling": "owner-only",
    "asOf": "2026-09-25T18:00:00Z",
    "revision": 1,
    "previousRevisionRef": null,
    "eventRefs": ["event-credit-observed", "event-bureau-entry", "event-issuer-attempt", "event-report-receipt", "event-tax-notice", "event-tax-call-receipt", "event-tax-status"],
    "surfaceRefs": ["surface-credit-account", "surface-tax-account"],
    "routeRefs": ["route-issuer-review", "route-identity-report", "route-tax-account-review"],
    "actionRefs": ["action-issuer-contact", "action-identity-report", "action-credit-dispute", "action-tax-contact"],
    "reportRefs": ["report-identity-recovery"],
    "disputeRefs": ["dispute-credit-entry"],
    "decisionRefs": ["decision-tax-open"],
    "gapRefs": ["gap-issuer-receipt", "gap-credit-residual", "gap-tax-conflict"]
  },
  "authorities": [
    { "id": "owner-rivera", "kind": "case-owner", "name": "Case owner", "authorizationSourceRef": null },
    { "id": "institution-credit-bureau", "kind": "institution", "name": "Credit bureau", "authorizationSourceRef": null },
    { "id": "institution-card-issuer", "kind": "institution", "name": "Card issuer", "authorizationSourceRef": null },
    { "id": "institution-tax-agency", "kind": "institution", "name": "Tax agency", "authorizationSourceRef": null },
    { "id": "institution-identity-recovery", "kind": "institution", "name": "Official identity recovery service", "authorizationSourceRef": null }
  ],
  "sources": [
    {
      "id": "source-owner-credit-observation",
      "kind": "owner-observation",
      "subjectRef": "event-credit-observed",
      "issuerAuthorityRef": "owner-rivera",
      "controlledRef": "workspace://identity-recovery/owner-credit-observation",
      "revision": "1",
      "publishedAt": "2026-09-18T16:00:00Z",
      "retrievedAt": "2026-09-18T16:05:00Z",
      "jurisdiction": "US-CA",
      "freshness": "current",
      "redaction": "minimized-reference-only",
      "containsSecrets": false
    },
    {
      "id": "source-bureau-entry",
      "kind": "institution-notice",
      "subjectRef": "surface-credit-account",
      "issuerAuthorityRef": "institution-credit-bureau",
      "controlledRef": "institution://credit-bureau/report-entry-redacted",
      "revision": "2026-09-18",
      "publishedAt": "2026-09-18T12:00:00Z",
      "retrievedAt": "2026-09-18T16:10:00Z",
      "jurisdiction": "US",
      "freshness": "current",
      "redaction": "minimized-reference-only",
      "containsSecrets": false
    },
    {
      "id": "source-issuer-route",
      "kind": "official-recovery-guidance",
      "subjectRef": "route-issuer-review",
      "issuerAuthorityRef": "institution-card-issuer",
      "controlledRef": "official://card-issuer/identity-review-route",
      "revision": "2026-08",
      "publishedAt": "2026-08-10T00:00:00Z",
      "retrievedAt": "2026-09-18T17:00:00Z",
      "jurisdiction": "US",
      "freshness": "current",
      "redaction": "minimized-reference-only",
      "containsSecrets": false
    },
    {
      "id": "source-owner-issuer-attempt",
      "kind": "owner-action-note",
      "subjectRef": "action-issuer-contact",
      "issuerAuthorityRef": "owner-rivera",
      "controlledRef": "workspace://identity-recovery/issuer-call-note",
      "revision": "1",
      "publishedAt": "2026-09-19T17:00:00Z",
      "retrievedAt": "2026-09-19T17:01:00Z",
      "jurisdiction": "US-CA",
      "freshness": "current",
      "redaction": "minimized-reference-only",
      "containsSecrets": false
    },
    {
      "id": "source-recovery-route",
      "kind": "official-recovery-guidance",
      "subjectRef": "route-identity-report",
      "issuerAuthorityRef": "institution-identity-recovery",
      "controlledRef": "official://identity-recovery/report-route",
      "revision": "2026-09",
      "publishedAt": "2026-09-01T00:00:00Z",
      "retrievedAt": "2026-09-19T18:00:00Z",
      "jurisdiction": "US",
      "freshness": "current",
      "redaction": "minimized-reference-only",
      "containsSecrets": false
    },
    {
      "id": "source-report-action-receipt",
      "kind": "independent-receipt",
      "subjectRef": "action-identity-report",
      "issuerAuthorityRef": "institution-identity-recovery",
      "controlledRef": "institution://identity-recovery/action-confirmation-redacted",
      "revision": "1",
      "publishedAt": "2026-09-20T19:02:00Z",
      "retrievedAt": "2026-09-20T19:05:00Z",
      "jurisdiction": "US",
      "freshness": "current",
      "redaction": "minimized-reference-only",
      "containsSecrets": false
    },
    {
      "id": "source-report-record-receipt",
      "kind": "independent-receipt",
      "subjectRef": "report-identity-recovery",
      "issuerAuthorityRef": "institution-identity-recovery",
      "controlledRef": "institution://identity-recovery/report-confirmation-redacted",
      "revision": "1",
      "publishedAt": "2026-09-20T19:02:00Z",
      "retrievedAt": "2026-09-20T19:05:00Z",
      "jurisdiction": "US",
      "freshness": "current",
      "redaction": "minimized-reference-only",
      "containsSecrets": false
    },
    {
      "id": "source-tax-notice",
      "kind": "institution-notice",
      "subjectRef": "surface-tax-account",
      "issuerAuthorityRef": "institution-tax-agency",
      "controlledRef": "institution://tax-agency/notice-redacted",
      "revision": "notice-2026-09",
      "publishedAt": "2026-09-16T00:00:00Z",
      "retrievedAt": "2026-09-21T16:00:00Z",
      "jurisdiction": "US",
      "freshness": "current",
      "redaction": "minimized-reference-only",
      "containsSecrets": false
    },
    {
      "id": "source-tax-route",
      "kind": "official-recovery-guidance",
      "subjectRef": "route-tax-account-review",
      "issuerAuthorityRef": "institution-tax-agency",
      "controlledRef": "official://tax-agency/identity-account-route",
      "revision": "2026-07",
      "publishedAt": "2026-07-01T00:00:00Z",
      "retrievedAt": "2026-09-21T16:30:00Z",
      "jurisdiction": "US",
      "freshness": "current",
      "redaction": "minimized-reference-only",
      "containsSecrets": false
    },
    {
      "id": "source-tax-action-receipt",
      "kind": "independent-receipt",
      "subjectRef": "action-tax-contact",
      "issuerAuthorityRef": "institution-tax-agency",
      "controlledRef": "institution://tax-agency/contact-confirmation-redacted",
      "revision": "1",
      "publishedAt": "2026-09-22T17:30:00Z",
      "retrievedAt": "2026-09-22T17:40:00Z",
      "jurisdiction": "US",
      "freshness": "current",
      "redaction": "minimized-reference-only",
      "containsSecrets": false
    },
    {
      "id": "source-tax-decision",
      "kind": "institution-decision",
      "subjectRef": "decision-tax-open",
      "issuerAuthorityRef": "institution-tax-agency",
      "controlledRef": "institution://tax-agency/pending-status-redacted",
      "revision": "1",
      "publishedAt": "2026-09-22T17:35:00Z",
      "retrievedAt": "2026-09-22T17:40:00Z",
      "jurisdiction": "US",
      "freshness": "current",
      "redaction": "minimized-reference-only",
      "containsSecrets": false
    }
  ],
  "events": [
    { "id": "event-credit-observed", "kind": "owner-observation", "occurredAt": "2026-09-18T16:00:00Z", "assertionState": "owner-reported", "surfaceRefs": ["surface-credit-account"], "sourceRefs": ["source-owner-credit-observation"], "fraudDetermination": false },
    { "id": "event-bureau-entry", "kind": "institution-notice", "occurredAt": "2026-09-18T12:00:00Z", "assertionState": "institution-confirmed-fact", "surfaceRefs": ["surface-credit-account"], "sourceRefs": ["source-bureau-entry"], "fraudDetermination": false },
    { "id": "event-issuer-attempt", "kind": "owner-attempt", "occurredAt": "2026-09-19T17:00:00Z", "assertionState": "owner-reported", "surfaceRefs": ["surface-credit-account"], "sourceRefs": ["source-owner-issuer-attempt"], "fraudDetermination": false },
    { "id": "event-report-receipt", "kind": "receipt", "occurredAt": "2026-09-20T19:02:00Z", "assertionState": "independently-receipted-outcome", "surfaceRefs": ["surface-credit-account", "surface-tax-account"], "sourceRefs": ["source-report-action-receipt", "source-report-record-receipt"], "fraudDetermination": false },
    { "id": "event-tax-notice", "kind": "institution-notice", "occurredAt": "2026-09-16T00:00:00Z", "assertionState": "institution-confirmed-fact", "surfaceRefs": ["surface-tax-account"], "sourceRefs": ["source-tax-notice"], "fraudDetermination": false },
    { "id": "event-tax-call-receipt", "kind": "receipt", "occurredAt": "2026-09-22T17:30:00Z", "assertionState": "independently-receipted-outcome", "surfaceRefs": ["surface-tax-account"], "sourceRefs": ["source-tax-action-receipt"], "fraudDetermination": false },
    { "id": "event-tax-status", "kind": "institution-outcome", "occurredAt": "2026-09-22T17:35:00Z", "assertionState": "institution-confirmed-fact", "surfaceRefs": ["surface-tax-account"], "sourceRefs": ["source-tax-decision"], "fraudDetermination": false }
  ],
  "surfaces": [
    {
      "id": "surface-credit-account",
      "kind": "credit-file",
      "redactedIdentifier": "issuer-account-ending-0421",
      "institutionAuthorityRef": "institution-card-issuer",
      "state": "suspected-misuse",
      "eventRefs": ["event-credit-observed", "event-bureau-entry", "event-issuer-attempt", "event-report-receipt"],
      "routeRefs": ["route-issuer-review", "route-identity-report"],
      "actionRefs": ["action-issuer-contact", "action-identity-report", "action-credit-dispute"],
      "reportRefs": ["report-identity-recovery"],
      "disputeRefs": ["dispute-credit-entry"],
      "decisionRefs": [],
      "gapRefs": ["gap-issuer-receipt", "gap-credit-residual"],